{
  "version": "v1",
  "name": "glengarry-v1",
  "description": "DNA Sales Arena flagship lead pack. 200 fully-synthetic B2B prospects — 20 hand-curated glengarry-tier premium leads with full intel + 180 deterministically-generated cold leads with sparse intel. Use this pack to boot the first Arena contest.",
  "synthetic": true,
  "createdAtUtc": "2026-05-18T00:00:00Z",
  "tags": [
    "b2b",
    "data-analytics-saas",
    "flagship",
    "fictional"
  ],
  "leads": [
    {
      "id": "L-0001",
      "tier": "glengarry",
      "company": {
        "name": "Yatzee Pharmaceutical",
        "industry": "pharma",
        "size": "enterprise",
        "region": "us-northeast",
        "domain": "yatzee-pharma.example",
        "headcount": 4200
      },
      "contact": {
        "firstName": "Olivia",
        "lastName": "Pendergast",
        "role": "VP Clinical Analytics",
        "email": "o.pendergast@yatzee-pharma.example",
        "phone": "555-0142"
      },
      "signals": [
        {
          "kind": "leadership_change",
          "summary": "New CFO appointed last quarter; analytics modernization listed in their first earnings call.",
          "timestampUtc": "2026-04-12T00:00:00Z"
        },
        {
          "kind": "content_engagement",
          "summary": "Three downloads of clinical-trial-analytics whitepaper in the last 14 days.",
          "timestampUtc": "2026-05-09T00:00:00Z"
        },
        {
          "kind": "hiring",
          "summary": "Posted 4 data-platform engineer roles on their careers page.",
          "timestampUtc": "2026-05-02T00:00:00Z"
        }
      ],
      "notes": "The Cadillac lead. Every persona wants this one."
    },
    {
      "id": "L-0002",
      "tier": "glengarry",
      "company": {
        "name": "Bluebottle Distribution",
        "industry": "logistics",
        "size": "mid-market",
        "region": "us-midwest",
        "domain": "bluebottle-dist.example",
        "headcount": 880
      },
      "contact": {
        "firstName": "Marcus",
        "lastName": "Vance",
        "role": "Director of Operations Analytics",
        "email": "m.vance@bluebottle-dist.example",
        "phone": "555-0234"
      },
      "signals": [
        {
          "kind": "expansion",
          "summary": "Opened third regional distribution center in March.",
          "timestampUtc": "2026-03-21T00:00:00Z"
        },
        {
          "kind": "content_engagement",
          "summary": "Watched the 'route-optimization ROI' webinar in full last Tuesday.",
          "timestampUtc": "2026-05-13T00:00:00Z"
        }
      ],
      "notes": "Williamson's perfect lead — they need scheduling clarity right now."
    },
    {
      "id": "L-0003",
      "tier": "glengarry",
      "company": {
        "name": "Riverbend Robotics",
        "industry": "manufacturing",
        "size": "mid-market",
        "region": "us-pacific-northwest",
        "domain": "riverbend-robotics.example",
        "headcount": 540
      },
      "contact": {
        "firstName": "Pria",
        "lastName": "Sundaram",
        "role": "Head of Production Intelligence",
        "email": "p.sundaram@riverbend-robotics.example",
        "phone": "555-0317"
      },
      "signals": [
        {
          "kind": "funding",
          "summary": "Closed $40M Series C, named 'predictive maintenance' as a top spending category.",
          "timestampUtc": "2026-04-28T00:00:00Z"
        },
        {
          "kind": "press_release",
          "summary": "Announced partnership with a national auto-OEM (no name disclosed).",
          "timestampUtc": "2026-05-05T00:00:00Z"
        },
        {
          "kind": "mutual_connection",
          "summary": "Connected to Yatzee Pharmaceutical's CFO via a Q1 industry panel.",
          "timestampUtc": "2026-02-18T00:00:00Z"
        }
      ],
      "notes": "Moss bait: they'll have technical objections about edge-deployment, and Moss has the counter."
    },
    {
      "id": "L-0004",
      "tier": "glengarry",
      "company": {
        "name": "Northpoint Hospitality Group",
        "industry": "hospitality",
        "size": "enterprise",
        "region": "us-northeast",
        "domain": "northpoint-hospitality.example",
        "headcount": 3100
      },
      "contact": {
        "firstName": "Henrik",
        "lastName": "Olafsson",
        "role": "SVP Guest Experience Data",
        "email": "h.olafsson@northpoint-hospitality.example",
        "phone": "555-0418"
      },
      "signals": [
        {
          "kind": "news",
          "summary": "Featured in a Hospitality Tech feature on 'next-gen loyalty programs.'",
          "timestampUtc": "2026-04-30T00:00:00Z"
        },
        {
          "kind": "content_engagement",
          "summary": "Six page views on the 'customer-lifetime-value' case study in one week.",
          "timestampUtc": "2026-05-11T00:00:00Z"
        }
      ],
      "notes": "Aaronow lead — patient, relationship-first close."
    },
    {
      "id": "L-0005",
      "tier": "glengarry",
      "company": {
        "name": "Saltmarsh Financial Services",
        "industry": "fintech",
        "size": "mid-market",
        "region": "us-southeast",
        "domain": "saltmarsh-fin.example",
        "headcount": 1200
      },
      "contact": {
        "firstName": "Jacinta",
        "lastName": "Reyes-Bell",
        "role": "Director of Risk Analytics",
        "email": "j.reyes-bell@saltmarsh-fin.example",
        "phone": "555-0509"
      },
      "signals": [
        {
          "kind": "compliance_event",
          "summary": "Recently completed a SOC 2 audit; mentioned analytics-tooling-gaps in the public summary.",
          "timestampUtc": "2026-04-08T00:00:00Z"
        },
        {
          "kind": "hiring",
          "summary": "Two posted roles for senior risk-analytics modelers.",
          "timestampUtc": "2026-05-14T00:00:00Z"
        },
        {
          "kind": "mutual_connection",
          "summary": "Board member overlaps with Bluebottle Distribution.",
          "timestampUtc": "2026-01-15T00:00:00Z"
        }
      ],
      "notes": "Compliance angle is the hook. Roma will lead with the audit story."
    },
    {
      "id": "L-0006",
      "tier": "glengarry",
      "company": {
        "name": "Cinderpath Education Networks",
        "industry": "education",
        "size": "mid-market",
        "region": "us-southwest",
        "domain": "cinderpath-edu.example",
        "headcount": 640
      },
      "contact": {
        "firstName": "Tomas",
        "lastName": "Whitaker",
        "role": "VP Institutional Analytics",
        "email": "t.whitaker@cinderpath-edu.example",
        "phone": "555-0612"
      },
      "signals": [
        {
          "kind": "expansion",
          "summary": "Acquired a smaller online-education provider in February.",
          "timestampUtc": "2026-02-22T00:00:00Z"
        },
        {
          "kind": "content_engagement",
          "summary": "Downloaded the 'student-outcome predictive modeling' ebook twice.",
          "timestampUtc": "2026-05-08T00:00:00Z"
        }
      ],
      "notes": "Post-acquisition data-consolidation pain. Levene angle: speed-to-quick-win."
    },
    {
      "id": "L-0007",
      "tier": "glengarry",
      "company": {
        "name": "Quillstone Publishing",
        "industry": "media",
        "size": "smb",
        "region": "us-northeast",
        "domain": "quillstone-pub.example",
        "headcount": 180
      },
      "contact": {
        "firstName": "Beatrice",
        "lastName": "Marwick",
        "role": "Chief Revenue Officer",
        "email": "b.marwick@quillstone-pub.example",
        "phone": "555-0714"
      },
      "signals": [
        {
          "kind": "leadership_change",
          "summary": "Beatrice was promoted from VP to CRO in March; first 90-day plan emphasized 'data-driven subscriber growth.'",
          "timestampUtc": "2026-03-04T00:00:00Z"
        },
        {
          "kind": "press_release",
          "summary": "Launched a new digital-subscription tier last week.",
          "timestampUtc": "2026-05-12T00:00:00Z"
        }
      ],
      "notes": "CRO with a public 90-day mandate. The fastest close on the board if you reach her in week 4."
    },
    {
      "id": "L-0008",
      "tier": "glengarry",
      "company": {
        "name": "Mossberg Agritech",
        "industry": "agritech",
        "size": "mid-market",
        "region": "us-midwest",
        "domain": "mossberg-agri.example",
        "headcount": 920
      },
      "contact": {
        "firstName": "Dane",
        "lastName": "Korhonen",
        "role": "Head of Field Operations Data",
        "email": "d.korhonen@mossberg-agri.example",
        "phone": "555-0823"
      },
      "signals": [
        {
          "kind": "product_launch",
          "summary": "Released a new IoT-soil-sensor platform in April.",
          "timestampUtc": "2026-04-17T00:00:00Z"
        },
        {
          "kind": "hiring",
          "summary": "Posted a 'sensor-data ML engineer' role last week.",
          "timestampUtc": "2026-05-10T00:00:00Z"
        }
      ],
      "notes": "Edge-compute story. Moss closes this one in his sleep if he can get on a call."
    },
    {
      "id": "L-0009",
      "tier": "glengarry",
      "company": {
        "name": "Halberd & Lark Construction",
        "industry": "construction",
        "size": "mid-market",
        "region": "us-mountain",
        "domain": "halberd-lark.example",
        "headcount": 760
      },
      "contact": {
        "firstName": "Imogen",
        "lastName": "Tachibana",
        "role": "Director of Project Analytics",
        "email": "i.tachibana@halberd-lark.example",
        "phone": "555-0915"
      },
      "signals": [
        {
          "kind": "news",
          "summary": "Won a major regional infrastructure contract; ribbon-cutting next month.",